Année,Numéro,Titre,Page(s),Auteur(s),Ville(s),Theme(s),Epoque
2020,Mémoire n°58,Le Blanco,47,Denis Bellon ,"Matheysine ,  Pays vizillois ",Vie locale ,XXe siècle 
2020,Mémoire n°58,Qu'est-ce qu'un zouave 7 (,48,Jean Caelen ,Pays vizillois ,"Histoires ,  Guerres ",XIXe siècle 
2020,Mémoire n°58,Châteauneuf à Haute-Jarrie,51,Pierre Coing Boyat ,Jarrie ,"Lieux remarquables ,  Patrimoine ",XIIIe siècle 
2020,Mémoire n°58,"Résistance : Paul Reymond, un des derniers témoins",61,Dominique Rossi ,Vizille ,"Guerres ,  Souvenirs ",XXe siècle 
2020,Mémoire n°58,Le symbolisme au cimetière Les animaux (2ème partie) (,64,Marie-Claude Argoud ,Vizille ,"Lieux du pays vizillois ,  Lieux remarquables ,  Traditions ",XIIIe siècle 
2020,Mémoire n°58,Une très curieuse adoption apparaît dans un registre d'état civil de Jarrie,68,Pierre Coing Boyat ,"Jarrie ,  Vizille ",Histoires ,XIXe siècle 
2020,Mémoire n°58,"L'eau, les canaux Lignes de vie de notre histoire",71,Marie-Claude Argoud ,"Pays vizillois ,  Vizille ","Vie locale ,  Lieux du pays vizillois ,  Activités industrielles ",XIXe siècle 
2020,Mémoire n°58,Table des articles publiés dans Mémoire du n° 56 au n° 63,73,Collectif - les Amis de l'Histoire ,Pays vizillois ,Vie de l'association ,XXIe siècle 
2020,Mémoire n°58,Table des articles publiés dans Mémoire du n° 49 au n° 55,80,- ,Vizille ,Vie de l'association ,XXIe siècle 
2020,Mémoire n°59,éditorial,2,Denis Bellon ,Pays vizillois ,Vie de l'association ,XXIe siècle 
2020,Mémoire n°59,La fin du carreau minier de Saint-Georges-de-Commiers,03 à 09,Jacques Gasqui ,"Matheysine ,  Saint Georges de Commiers ",",  Mines et minéralogie ,  Activités industrielles ,  Transports ",XXe siècle 
2020,Mémoire n°59,"Marius Bœuf (1898-1985), conducteur de trains sur le chemin de fer de La Mure",10 à 11,Fernand Boeuf ,"Matheysine ,  Saint Georges de Commiers ","Mines et minéralogie ,  Transports ",XXe siècle 
2020,Mémoire n°59,Souvenirs de la période 1939-1945 - Rencontre avec Fernand Bœuf,12 à 14,Jacques Gasqui ,Saint Georges de Commiers ,"Mines et minéralogie ,  Activités industrielles ,  Transports ",XXe siècle 
2020,Mémoire n°59,Les origines de Vizille,20,Quentin Jagadzinskil ,"Pays vizillois ,  Vizille ",Histoires ,IIe siècle 
2020,Mémoire n°59,"Vieille-Morte « Une histoire de roche, d'eau... et d'hommes » (",28,Nathalie Poiret ,"Pays vizillois ,  Bourg d'Oisans ","Lieux du pays vizillois ,  Lieux remarquables ,  Eau, rivières, canaux et fontaines ,  Archéologie ",XXIe siècle 
2020,Mémoire n°59,Le premier festival de Vizille en 1973 - Till l'espiègle,35,Jeannette Della-Vedova ,Vizille ,"Vie locale ,  Théâtre ",XXe siècle 
2020,Mémoire n°59,Le Manoir des Rolland,53,Pierre Coing Boyat ,Jarrie ,"Lieux du pays vizillois ,  ,  Bâtiments et édifices ",XVIIIe siècle 
2020,Mémoire n°59,"Saint-Roch, patron des épidémies (Monique Bonvallet)",60,"Denis Bellon , Monique Bonvallet ",France ,Personnages remarquables ,XIVe siècle 
2020,Mémoire n°59,La peste en 1348 ..,65,Denis Bellon ,"Jarrie ,  Vizille ","Histoires ,  Grandes périodes ",XIVe siècle 
2020,Mémoire n°59,Brèves de peste,69,Pierre Coing Boyat ,Pays vizillois ,"Histoires ,  Grandes périodes ,  Récits ",XIVe siècle 
2020,Mémoire n°59,Regards d'artistes,73,Henri Ondel ,Vizille ,Arts ,XXIe siècle 
2020,Mémoire n°59,« Marianne de profil » à l'Hôtel de Ville de Vizille,77,Denis Bellon ,Vizille ,"Lieux remarquables ,  Arts ",XIXe siècle 
2020,Mémoire n°59,Le tableau de l'Assemblée de Vizille par Alexandre Debelle,80,Paul Girard ,"Isère ,  Vizille ,  France ","Lieux remarquables ,  Arts ",XIXe siècle 
2021,Mémoire n°60,Éditorial,2,Denis Bellon ,Vizille ,Vie de l'association ,XXIe siècle 
2021,Mémoire n°60,Le retour de Lucie Baud,3,Michèle Perrot ,Vizille ,Personnages remarquables ,XXe siècle 
2021,Mémoire n°60,Un nouveau siège - De Notre-Dame de Mésage à Vizille (,04 à 06,Denis Bellon ,Vizille ,Vie de l'association ,XXIe siècle 
2021,Mémoire n°60,Quatre prix,7,Denis Bellon ,Vizille ,Vie de l'association ,XXIe siècle 
2021,Mémoire n°60,Quatre prix,7,Denis Bellon ,Vizille ,Vie de l'association ,XXIe siècle 
2021,Mémoire n°60,Les grands rendez-vous de l'histoire du Pays Vizillois,07 à 26,Denis Bellon ,Vizille ,Vie de l'association ,XXIe siècle 
2021,Mémoire n°60,Les numéros spéciaux,43,Denis Bellon ,Vizille ,Vie de l'association ,XXIe siècle 
2021,Mémoire n°60,"Mémoire, la revue",53,Collectif - les Amis de l'Histoire ,Pays vizillois ,Vie de l'association ,XXIe siècle 
2021,Mémoire n°60,"Les assemblées générales, de Vizille à Champ-sur-Drac",55,Jacques Gasqui ,Pays vizillois ,Vie de l'association ,XXIe siècle 
2021,Mémoire n°60,"Vizille, ville en transition",57,Denis Bellon ,Vizille ,"Activités industrielles ,  Activités artisanales ,  Activités commerçantes ,  Actualités ",XXIe siècle 
2021,Mémoire n°60,Faisons chanter « l'orgue du Pays Vizillois »,60,Daniel Blanc-Gonnet ,Vizille ,Lieux remarquables ,XXIe siècle 
2021,Mémoire n°60,S.O.S. Prieuré,65,"Pierrette Tournier ,  Nathalie Poiret ",Vizille ,",  Lieux remarquables ",XXIe siècle 
2021,Mémoire n°60,"La mascarade passe, et lonlonlère...",68 à 70,"- ,  Michèle Delahaye-Ferrafiat ",Vizille ,"Vie locale ,  Récits ",XXIe siècle 
2021,Mémoire n°60,Les nouveaux outils de communication,70,Daniel Blanc-Gonnet ,Vizille ,"Vie de l'association ,  Medias ,  technologies ",XXIe siècle 
2021,Mémoire n°60,Le patrimoine funéraire,73,Daniel Blanc-Gonnet ,Vizille ,",  Vie de l'association ",XXIe siècle 
2021,Mémoire n°60,"Saint-Roch, patron des épidémies (suite)",73,Monique Bonvallet ,Pays vizillois ,"Religions ,  Traditions ",- 
2021,Mémoire n°60,Histoire de Haute-Jarrie et de la famille Teyssier de Savy (suite),76,Pierre Coing Boyat ,Jarrie ,"Histoires ,  Personnages remarquables ",XIXe siècle 
2021,Mémoire n°61,Éditorial,2,Denis Bellon ,"Laffrey ,  Vizille ",Edito ,XVe siècle 
2021,Mémoire n°61,"L'épopée de Napoléon, d'une île à l'autre",03 à 09,Patrick Laudet ,"Laffrey ,  Pays vizillois , Vizille ,  Brié ,  France ","Vie locale ,  Histoires ,  Grandes périodes , Personnages remarquables ",XVIIIe siècle 
2021,Mémoire n°61,Le destin de la statue équestre de l'empereur,10 à 14,Raymond Joffre ,"Grenoble ,  Laffrey ,  Pays vizillois ","Histoires ,  Personnages remarquables ,  Arts ",XIXe siècle 
2021,Mémoire n°61,"Dominique Jean Larrey, chirurgien en chef de la Grande Armée",15 à 20,"Denis Bellon ,  Jacques Gasqui ",Pays vizillois ,"Guerres ,  Grandes périodes ,  Personnages remarquables ",XIXe siècle 
2021,Mémoire n°61,Napoléon et la réglementation minière - La loi du 21 avril 1810,21 à 22,Marie-Christine Bailly-Maitre - ,"Pays vizillois ,  France ","Mines et minéralogie ,  Grandes périodes ",XIXe siècle 
2021,Mémoire n°61,La statue équestre de Napoléon à Laffrey,23 à 25,- ,Laffrey ,"Histoires ,  Personnages remarquables ,  Arts ",XIXe siècle 
2021,Mémoire n°61,Les « Réfugiés Politiques Espagnols »,26 à 28,Carlos Vasquez-Marquénez ,Vizille ,"Histoires ,  Guerres ",XXe siècle 
2021,Mémoire n°61,Le catalogue,41,- ,- ,Vie de l'association ,XXIe siècle 
2021,Mémoire n°61,La vie de deux adolescents dans la tourmente de la guerre (1939-1945) - Pierre Ruibet et Mathilde Robert,54 à 57,Albert Samuell ,Vizille ,"Guerres ,  Personnages remarquables , Evènements ",XXe siècle 
2021,Mémoire n°61,Pierre Ruibet - Histoire complète,58 à 61,gérard Guétat ,"Vizille ,  France ","Guerres ,  Personnages remarquables ",XXe siècle 
2021,Mémoire n°61,Mistral gagnant à la Gaffe Vizille,62 à 67,"Cécile Mauvy (Vivarat) , Monique Canie ",Vizille ,Souvenirs ,XXe siècle 
2021,Mémoire n°61,La Pierre des rois,68 à 70,Interview ,Pays vizillois ,Histoires ,XXIe siècle 
2021,Mémoire n°61,Souvenir de l'Occupation à Saint-Georges-de-Commiers (rencontre avec Jany Filhol),71 à 73,"Jacques Gasqui , Interview ","Pays vizillois ,  Saint Georges de Commiers ","Histoires ,  Guerres ,  Récits ",XXe siècle 
2021,Mémoire n°61,Qui était « Patte d'ours » et que nous raconte Alexandre Debelle ?,74 à 78,"- ,  Jean Vallon ",Vizille ,"Histoires ,  Arts ",XIXe siècle 
2022,Mémoire N°62,Éditorial,2,Denis Bellon ,Pays vizillois ,Vie de l'association ,XXIe siècle 
2022,Mémoire N°62,Première du Festival de Vizille,03 à 04,Louis Beyler ,Vizille ,Théâtre ,XXe siècle 
2022,Mémoire N°62,Les festivals de Louis Beyler - 1976-La mère,05 à 11,Jeannette Della-Vedova ,Vizille ,Théâtre ,XXe siècle 
2022,Mémoire N°62,"Paul Michel, photographe",12 à 15,Jean Huyghe ,Vizille ,Arts ,XXe siècle 
2022,Mémoire N°62,"Paul Michel, photographe",12 à 15,Jean Huyghe ,"Vizille ,  Belledonne , L'Oisans ",Arts ,XXe siècle 
2022,Mémoire N°62,"Paul Michel, photographe",12 à16,Jean Huyghe ,"Massif de Belledonne , Vizille ,  L'Oisans ","Lieux remarquables ,  Souvenirs ,  Photographie ",XXe siècle 
2022,Mémoire N°62,Les élèves découvrent Vizille - Le château du Roi,17 à 18,- ,Vizille ,"Lieux remarquables ,  Histoires ",XXIe siècle 
2022,Mémoire N°62,Les élèves découvrent Vizille - Notre Mairie,19 à 20,Rémi Riolan ,Vizille ,"Lieux remarquables ,  Histoires ",XXIe siècle 
2022,Mémoire N°62,Mathématiques et chemins de fer (ou René Thom sur le petit train de La Mure] (-,21 à 22,Jacques Gasqui ,"Matheysine ,  Vizille ","Voies de communication ,  Transports ",XXe siècle 
2022,Mémoire N°62,La maison de Petichet,23 à 25,"- ,  Evelyne Dress ",Matheysine ,"Lieux remarquables ,  Littérature ",XXe siècle 
2022,Mémoire N°62,Raconte-moi Allemond,26 à 31,Pierrette Tournier ,Allemond (38114) ,"Histoires ,  Théâtre ",XXIe siècle 
2022,Mémoire N°62,Ambiance à Vaulnaveys (,32 à 34,Pierre Coing Boyat ,Vaulnaveys le haut ,Souvenirs ,XVIIIe siècle 
2022,Mémoire N°62,Les ascensions oubliées des officiers géographes (1748-1778),35 à 40,"Olivier Joseph ,  Paul Billon-grand ",L'Oisans ,"Lieux remarquables ,  Histoires ",XVIIIe siècle 
2022,Mémoire N°62,Le prieuré de Vizille en BD,41 à 44,Pierre Martin ,Vizille ,Lieux remarquables ,XXIe siècle 
2022,Mémoire N°62,Le prieuré de Vizille en BD,41 à 44,Georges Martin ,Vizille ,"Lieux du pays vizillois ,  Bâtiments et édifices ,  Lieux remarquables ,  Religions ",Xe siècle 
2022,Mémoire N°62,La Pierre des Rois (suite),45 à 46,Georges Martin ,Saint Pierre de Mésage ,Arts ,XXIe siècle 
2022,Mémoire N°62,Pour en savoir plus - Une promenade dans les salles du Louvre,47 à 49,Denis Bellon ,"Pays vizillois ,  France ","Lieux remarquables ,  Arts ",XXIe siècle 
2022,Mémoire N°62,L'histoire discrète de l'église Saint-Antoine de Livet,50 à 54,Caroline Guérin ,Livet et Gavet ,"Lieux du pays vizillois ,  ,  Lieux remarquables , Religions ,  Arts ",XIIIe siècle 
2022,Mémoire N°62,Le travail textile à Vizille,55 à 69,Quentin Jagadzinskil ,Vizille ,",  Activités industrielles ",XVIIIe siècle 
2022,Mémoire N°62,Vieille-Morte - Des logis et des écuries ? Des ruines...,70 à 79,Nathalie POIRET ,L'Oisans ,",  Histoires ",XIIe siècle 
2022,Mémoire N°62,Les déplacements de Jean Jaurès en région « Rhône-Alpes » (),79,Catherine Moulin ,Vizille ,"Personnages remarquables ,  Evènements ",XIXe siècle 
2022,Mémoire N°62,Les déplacements de Jean Jaurès en région «Rhône-Alpes» - 2ème partie,80 à 83,- ,Vizille ,"Histoires ,  Personnages remarquables ",XIXe siècle 
2022,Mémoire n°63,Éditorial,2,Denis Bellon ,"Pays vizillois ,  Vizille ",",  Histoires ",XXIe siècle 
2022,Mémoire n°63,L'ancien canton de Vizille de la préhistoire à l'AN MIL,03 à 09,Jean-Claude Michel ,"Pays vizillois ,  Vizille ","Lieux du pays vizillois ,  ,  Grandes périodes ",Avant J-C 
2022,Mémoire n°63,La « Fontaine puant » au hameau des Essoulieux (commune du Bourg d'Oisans),10 à 11,Nathalie Poiret ,Bourg d'Oisans ,"Lieux remarquables ,  Eau, rivières, canaux et fontaines ",XXIe siècle 
2022,Mémoire n°63,Le dernier train,12 à 19,Denis Bellon ,"Pays vizillois ,  Vizille ",Voies de communication ,XXe siècle 
2022,Mémoire n°63,Les mémoires de Carmen Saunier,20 à 36,Carmen Saunier ,"Pays vizillois ,  Vizille ,  Bourg d'Oisans ","Histoires ,  Souvenirs ",XXe siècle 
2022,Mémoire n°63,Les Gourlus,37 à 40,Claudie Picot ,Vizille ,Théâtre ,XXe siècle 
2022,Mémoire n°63,Le prieuré de Vizille en BD,41 à 44,Georges Martin ,Vizille ,",  Bâtiments et édifices ,  Lieux remarquables , Religions ",XIIe siècle 
2022,Mémoire n°63,L'histoire du château de Cornage de Lesdiguières à nos jours,45 à 46,"Gérard Mingat , Gilles Rey ",Vizille ,",  Bâtiments et édifices ,  Lieux remarquables ",XVIIIe siècle 
2022,Mémoire n°63,Bon Repos - Grandeur et décadence ou les misères d'un château,47 à 55,Pierre Coing Boyat ,Jarrie ,",  Bâtiments et édifices ,  Lieux remarquables ",XIVe siècle 
2022,Mémoire n°63,"L'Académie Delphinale, 250 ans d'histoire et de mémoire en Dauphiné",56 à 58,Denis Bellon ,Isère ,",  Documents remarquables ",XVIIIe siècle 
2022,Mémoire n°63,1982 - Les Trois Mousquetaires - Louis Beyler Le Festival de Vizille fête ses 10 ans...,59 à 66,Jeannette Della-Vedova ,Vizille ,"Théâtre ,  Arts ",XXe siècle 
2022,Mémoire n°63,"Casimir, André, Gérard Berthon et le rugby",67 à 72,Jeannette Della-Vedova ,Vizille ,"Souvenirs ,  Sport ",XXe siècle 
2022,Mémoire n°63,Balade vizilloise au fil des panneaux,73 à 81,Pierrette Tournier ,Vizille ,",  Bâtiments et édifices ,  Lieux remarquables ,  Vie de l'association ",XXIe siècle 
2023,Mémoire n°64,Éditorial,2,Denis Bellon ,"Vizille ,  - ","Lieux du pays vizillois ,  ,  Lieux remarquables , Divers ",XXIe siècle 
2023,Mémoire n°64,Le poids public de Vizille ou « la bascule »,12 à 20,Nathalie POIRET ,- ,"Bâtiments et édifices ,  Histoires ",XIXe siècle 
2023,Mémoire n°64,Le cahier de route de Charvet,20 à 27,Pierrette Tournier ,"Vizille ,  - ","Histoires ,  Personnages remarquables ",XIXe siècle 
2023,Mémoire n°64,Le tram ne viendra plus sur la place,28,Denis Bellon ,Vizille ,"Voies de communication ,  Histoires ",XXe siècle 
2023,Mémoire n°64,Ils eurent leur temps de célébrité...! maintenant nos vieux trams tombent sous les coups des démolisseurs,29,Aimé Mollard ,Vizille ,"Voies de communication ,  Souvenirs ",XXe siècle 
2023,Mémoire n°64,Le petit train départemental des V.F.D. a fait son dernier voyage,30 à 31,Denis Bellon ,"Vizille ,  Bourg d'Oisans ",Voies de communication ,XXe siècle 
2023,Mémoire n°64,Des locomotives au pied des Alpes - De la gare Jarrie-Vizille à la gare,32 à 35,Pascal Reinhard ,"Jarrie ,  Vizille ",Voies de communication ,XXe siècle 
2023,Mémoire n°64,Champagne à Brié - Mont-Rolland,36 à 40,"Pierre Coing Boyat , Denise Rostaing ",Jarrie ,"Histoires ,  Enseignement ",XIXe siècle 
2023,Mémoire n°64,Le prieuré de Vizille en BD,41 à 44,Georges Martin ,Vizille ,",  Bâtiments et édifices ,  Lieux remarquables , Religions ,  Arts ",XIIIe siècle 
2023,Mémoire n°64,1979 - Ah ! Si Arthur était là... Le Vilème festival de Vizille,45 à 52,Jeannette Della-Vedova ,Vizille ,"Vie locale ,  Contes et légendes ,  Théâtre ",XIIe siècle 
2023,Mémoire n°64,Histoire de la famille Brun - Du rouleau à pâtisserie au rouleau compresseur !,53 à 59,Jean-Louis Philip ,Vizille ,"Activités industrielles ,  Activités commerçantes , Personnages remarquables ",XIXe siècle 
2023,Mémoire n°64,Les facteurs ruraux du Pays Vizillois sous le Second Empire,60 à 63,Jacques Gasqui ,"Vizille ,  Canton (38220) ",Vie locale ,XIXe siècle 
2023,Mémoire n°64,Le centre d'apprentissage bilan d'une année de travail - 14 juillet 1952,64 à 65,Denis Bellon ,Vizille ,"Enseignement ,  Souvenirs ",XXe siècle 
2023,Mémoire n°64,Jean Seyer (Surville nom de code dans la Résistance) un Lorrain au maquis de l'Disans,66 à 70,Denis Bellon ,Vizille ,"Histoires ,  Guerres ,  Grandes périodes , Evènements ",XXe siècle 
2023,Mémoire n°64,Essai sur l'histoire minière et minéralogique des anciennes mines de fer de la commune de Saint-Pierre de Mésage,71 à 81,- ,Saint Pierre de Mésage ,Mines et minéralogie ,XVIIIe siècle 
2023,Mémoire n°64,Les courriers de nos lecteurs,82,- ,- ,Vie de l'association ,XXIe siècle 
2023,Mémoire n°65,Éditorial,2,Denis Bellon ,Vizille ,Vie de l'association ,XXIe siècle 
2023,Mémoire n°65,"La recherche historique, une histoire à rebondissements",03 à 09,Pierre Coing Boyat ,Canton (38220) ,"Lieux du pays vizillois ,  Lieux remarquables ,  Histoires , Documents remarquables ",XXe siècle 
2023,Mémoire n°65,La centrale hydroélectrique des Vernes - Une histoire remarquable,10 à 17,Marie-Christine Bailly-Maitre - ,"Séchilienne ,  Livet et Gavet ,  Rioupéroux ","Activités industrielles ,  Personnages remarquables ,  Eau, rivières, canaux et fontaines ",XIXe siècle 
2023,Mémoire n°65,Les édifices religieux de l'ancien canton de Vizille - fère partie,18 à 30,Jean-Claude Michel ,Canton (38220) ,",  Bâtiments et édifices ,  Religions ",Ve siècle 
2023,Mémoire n°65,La remplaçante,31 à 35,Collectif - les Amis de l'Histoire ,Vizille ,Littérature ,XXe siècle 
2023,Mémoire n°65,La poésie du jour par l'intelligence artificielle sur Vizille,36,Roland Mastrorillo ,Vizille ,Divers ,XXIe siècle 
2023,Mémoire n°65,Symphonie lacustre - Les lacs du Dauphiné - fère partie,38 à 40,Thierry Grand ,"Laffrey ,  L'Oisans ,  Canton (38220) ","Lieux remarquables ,  Eau, rivières, canaux et fontaines ",XXIe siècle 
2023,Mémoire n°65,Parrainage des tuyaux d'orgue,41 à 44,Daniel Blanc-Gonnet ,Vizille ,",  Bâtiments et édifices ,  Lieux remarquables ,  Arts ",XXIe siècle 
2023,Mémoire n°65,Symphonie lacustre - Les lacs du Dauphiné (suite),45 à 49,Thierry Grand ,"Massif de Belledonne , L'Oisans ","Lieux remarquables ,  Eau, rivières, canaux et fontaines ",XXIe siècle 
2023,Mémoire n°65,Restauration de la locomotive à vapeur bicabine n° 31 en Ardèche,50 à 51,Denis Bellon ,France ,",  Voies de communication ",XXIe siècle 
2023,Mémoire n°65,Maurice Gaillard,52 à 54,Bernard Tixier ,Vizille ,"Guerres ,  Grandes périodes ,  Personnages remarquables ",XXe siècle 
2023,Mémoire n°65,L'histoire dans les archives communales - Le vingt-quatrième des pauvres,55 à 56,Pierre Coing Boyat ,"France ,  Canton (38220) ","Religions ,  Divers ",XVIIIe siècle 
2023,Mémoire n°65,Souvenirs de Mohamed Boumeghra,57 à 58,Jeannette Della-Vedova ,Vizille ,"Vie locale ,  Evènements ,  Souvenirs ",XXe siècle 
2023,Mémoire n°65,Les vingt ans de l'association des amis de la chapelle,59 à 60,- ,Vizille ,",  Actualités ",XXIe siècle 
2023,Mémoire n°65,Les vingt ans de l'association des amis de la chapelle Saint-Barthélemy à Sersigaud,"59 à ,60",Jocelyne BELLON ,France ,",  Bâtiments et édifices ,  Lieux remarquables ,  Personnages remarquables ",XXIe siècle 
2023,Mémoire n°65,La chapelle Saint-Barthélemy à Sersigaud,61 à 68,Paul Schwoerer ,Matheysine ,",  Bâtiments et édifices ,  Lieux remarquables ,  Religions ",- 
2023,Mémoire n°65,La complainte de Mandrin,69 à 72,Gilbert Jacquet ,France ,Histoires ,XVIIIe siècle 
2023,Mémoire n°65,Vizille demain,73 à 78,Denis Bellon ,Vizille ,"Activités artisanales ,  Activités commerçantes ,  Arts ",XXIe siècle 
2024,Mémoire n°66,40000€ pour le prieuré de Vizille,1,Denis Bellon ,Vizille ,"Lieux remarquables ,  Vie de l'association ,  Patrimoine ",XXIe siècle 
2024,Mémoire n°66,Éditorial,2,- ,Pays vizillois ,Edito ,XXIe siècle 
2024,Mémoire n°66,L'ancien diocèse de Grenoble et son art roman - Le Pays Vizillois,3,Apolinne Troyes ,Pays vizillois ,"Lieux du pays vizillois ,  Lieux remarquables ,  Histoires ,  Religions , Arts ",IXe siècle 
2024,Mémoire n°66,Bâtiments et monuments que la pierre a bâtis !,19,Thierry Grand ,Pays vizillois ,"Lieux remarquables ,  Mines et minéralogie ",Avant J-C 
2024,Mémoire n°66,Les édifices religieux de l'ancien canton de Vizille - 2ème partie,31,Jean-Claude Michel ,Pays vizillois ,"Lieux du pays vizillois ,  Bâtiments et édifices ,  Lieux remarquables ,  Religions ,  Arts ",IXe siècle 
2024,Mémoire n°66,La remplaçante (suite),44,- ,Pays vizillois ,"Personnages remarquables ,  Littérature ",XXe siècle 
2024,Mémoire n°66,La poésie du jour 0 par l'intelligence artificielle sur Vizille,49,- ,Vizille ,"Littérature ,  technologies ",XXIe siècle 
2024,Mémoire n°66,les mines de l’hermine,50,Marie-Christine Bailly-Maitre - ,"L'Oisans ,  L'Alpe d'Huez ","Activités industrielles ,  Montagne ,  Récits ,  Géologie ",XIXe siècle 
2024,Mémoire n°66,Lucie Baud a enfin son école à Saint-Pierre de Mésage,61,Denis Bellon ,Saint Pierre de Mésage ,"Histoires ,  Grandes périodes ,  Personnages remarquables ",XXIe siècle 
2024,Mémoire n°66,Le tremplin de Saint-Nizier,64,Denis Bellon ,Grenoble ,"Lieux remarquables ,  Histoires ,  Evènements ,  Sport ",XXe siècle 
2024,Mémoire n°66,Cérémonie du 11 novembre 2023,67,Pierrette Tournier ,"Pays vizillois , Vizille ","Vie locale ,  Guerres ,  Souvenirs ,  Récits ,  Traditions ",XXIe siècle 
2024,Mémoire n°66,Rencontre à Séchilienne,69,Bernard Ycart ,Pays vizillois ,"Histoires ,  Personnages remarquables ,  Récits ",XVIIIe siècle 
2024,Mémoire n°66,Et si on parlait BD ?,78,Georges Martin ,Pays vizillois ,"Arts ,  Bande dessinée ",XXIe siècle 
2024,Mémoire n°67,Éditorial,2,Denis Bellon,Vizille,Vie associative / Introduction,XXIe siècle
2024,Mémoire n°67,Les papeteries de Vizille - Une histoire de familles,3,Gérard Coste,Vizille,Histoire industrielle / Papeterie,XIXe-XXe siècles
2024,Mémoire n°67,Château de Maupertuis dit Château d’Hugues,15,Pierre Coing-Boyat,Vizille,Patrimoine bâti / Châteaux,Moyen Âge
2024,Mémoire n°67,Le chemin de croix de Luc Barbier à l’église de Vizille,23,"Michel Merlin, Michel Vallon",Vizille,Art religieux / Patrimoine religieux,XXe siècle
2024,Mémoire n°67,Un parcours historique vizillois,27,,Vizille,Parcours patrimonial / Découverte locale,XXe siècle
2024,Mémoire n°67,La poterne du Château du Roi,29,La classe de CM1 de l’École Jean Jaurès à Vizille,Vizille,Patrimoine bâti / Architecture militaire,XXe siècle
2024,Mémoire n°67,"VIIIᵉ festival de Vizille : Roméo et Juliette 19, 20, 21, 24, 25, 26, 27, 28 juin 1980",33,Jeannette Della Vedova,Vizille,Culture / Festivals / Théâtre,XXe siècle
2024,Mémoire n°67,IXᵉ festival de Vizille - 1981 - Songe d’une nuit d’été,37,Jeannette Della Vedova,Vizille,Culture / Festivals / Théâtre,XXe siècle
2024,Mémoire n°67,La remplaçante (suite),41,Henri Bordeaux,Vizille,Littérature / Souvenirs,XXe siècle
2024,Mémoire n°67,L’orgue de Vizille - À la recherche de parrains pour ses tuyaux,47,Daniel Blanc-Gonnet,Vizille,Patrimoine musical / Orgues,XXe siècle
2024,Mémoire n°67,Le clocher de l’église Sainte-Marie de Clelles,51,Marcel Perrichon,Clelles,Patrimoine religieux / Architecture,XIXe siècle
2024,Mémoire n°67,L’église Saint-Étienne de Haute-Jarrie,56,Pierre Coing-Boyat,Haute-Jarrie,Patrimoine religieux / Architecture,XIXe siècle
2024,Mémoire n°67,Dans les secrets de la minéralogie en Matheysine,62,Thierry Grand,Matheysine,Sciences naturelles / Minéralogie,XXe siècle
2024,Mémoire n°67,"Vizille, capitale du cinéma !",71,Jean-Louis Rossi,Vizille,Culture / Cinéma,XXe siècle
2024,Mémoire n°67,Été 1903 : avec les chasseurs alpins au Mont Aiguille,74,Jacques Gasqui,Mont Aiguille,Mémoire militaire / Chasseurs alpins,XXe siècle
2024,Mémoire n°67,Souscription « Le Pays Vizillois à l’épreuve de la guerre - 1940 - 1945 »,77,,Vizille,Deuxième Guerre mondiale / Résistance,XXe siècle
2024,Mémoire n°67,Carnet de route d’un maquisard Raymond BREDÈCHE,78,Pierrette Tournier,Oisans ou Vizille,Deuxième Guerre mondiale / Résistance,XXe siècle
2024,Mémoire n°67,Rassemblons nos souvenirs,84,Jocelyne Bellon,Vizille,Mémoire collective / Témoignages,XXe-XXIe siècle
2024,Mémoire n°67,La page utile,,,Vizille,Vie pratique / Informations utiles,XXIe siècle
2025,Mémoire n°68,Éditorial,2,Denis Bellon,Vizille,Vie associative / Introduction,XXIe siècle
2025,Mémoire n°68,Exposition internationale de la Houille Blanche et du tourisme de Grenoble,3,Alain Robert,Grenoble,Expositions / Tourisme / Hydroélectricité,XXe siècle
2025,Mémoire n°68,La fonderie d’or de Saint-Maurice en Trièves - Témoin de la proto-industrialisation en milieu rural au milieu du XIVe siècle,14,Alice Rouch-Colomb,Saint-Maurice-en-Trièves,Proto-industrialisation / Métallurgie,XIVe siècle
2025,Mémoire n°68,Des trésors d’Histoire à Vizille - Les collections du Centre de Ressources Albert Soboul,22,"Bernard Ycart, Véronique Despine-Faure",Vizille,Collections patrimoniales / Musées,XXIe siècle
