Année,Numéro,Titre,Page(s),Auteur(s),Ville(s),Theme(s),Epoque
2008,Mémoire n°34,Un triste mois de janvier à Brié : le meurtre du café restaurant Vigier,50 à 53,Pierre Melquiond ,Brié ,Actualités ,- 
2008,Mémoire n°34,Actualités,54,- ,- ,Actualités ,- 
2008,Mémoire n°34,Les anciennes familles de Brié et Angonnes : la famille Ogier,55,Pierre Melquiond ,Brié et Angonnes ,Personnages remarquables ,- 
2008,Mémoire n°35,"La ferme ""présidentielle"" du chateau de Vizille",04 à 08,Danielle Amar ,Vizille ,Bâtiments et édifices ,- 
2008,Mémoire n°35,Promenade découverte à partir du saut du moine,09 à 16,Alain Romestant ,Champagnier ,Activités industrielles ,- 
2008,Mémoire n°35,Nos hommes de la révolutions,17 à 21,Pierre Melquiond ,Pays vizillois ,Personnages remarquables ,- 
2008,Mémoire n°35,"Vizille et ses commerces - Les rues : Casimir. Périer, de la République, Sadi Carnot",22 à 30,Jeannette Della-Vedova ,Vizille ,Vie locale ,XXe siècle 
2008,Mémoire n°35,I - Le parc du chateau du roi,31 à 35,Denis Bellon ,Vizille ,Bâtiments et édifices ,- 
2008,Mémoire n°35,Le chateau des Simianes à Haute-Jarrie,36 à 49,Pierre Coing Boyat ,Jarrie ,Bâtiments et édifices ,- 
2008,Mémoire n°35,"Souvenirs de Georges Vivier : un ""personnage"", une ""figure"" humaniste",50,Pierre Coing Boyat ,Jarrie ,Personnages remarquables ,- 
2009,Mémoire n°36,La toponymie,3,Robert Aillaud ,- ,"Patois ,  Toponymie ",- 
2009,Mémoire n°36,Fermage à Chachatier en 1730,04 à 05,Bernard Mingone ,Vaulnaveys le bas ,Activités agricoles ,- 
2009,Mémoire n°36,Un courroux... magistral,06 à 07,Paul Kiener ,Vizille ,Vie locale ,- 
2009,Mémoire n°36,La méridienne du bar de la Paix,08 à 10,Denis Bellon ,Vizille ,Bâtiments et édifices ,- 
2009,Mémoire n°36,Hercule de retour à Vizille,11 à 14,Robert Aillaud ,Vizille ,Bâtiments et édifices ,- 
2009,Mémoire n°36,"Vizille, les maisons de l'abbé Pierre",15 à 20,Jeannette Della-Vedova ,Vizille ,Vie locale ,XXe siècle 
2009,Mémoire n°36,Accident miraculeux à Huez,21,Michèle Bruyat ,L'Alpe d'Huez ,Evènements ,- 
2009,Mémoire n°36,Barrage de l'Etroit... de l'eau qui a fait couler beaucoup d'encre!,22 à 30,Alain Romestant ,Pays vizillois ,"Eau, rivières, canaux et fontaines ",- 
2009,Mémoire n°36,"A Brié, elles aussi ont une histoire",31,Pierre Melquiond ,Brié ,Vie locale ,- 
2009,Mémoire n°36,Brié et ses environs en 1922 : promenade d'automne autour des 4 seigneurs,32 à 36,Pierre Melquiond ,Eybens ,Vie locale ,- 
2009,Mémoire n°36,Curiosités de nos archives communales - Jarrie,37 à 40,Pierre Coing Boyat ,Jarrie ,Documents remarquables ,- 
2009,Mémoire n°36,Eté 2009 - Patrimoine en fête,41 à 42,- ,Pays vizillois ,Actualités ,- 
2009,Mémoire n°36,La desserte ferroviaire de la vallée de la Romanche,43 à 48,Jean-Louis Rochaix ,L'Oisans ,Voies de communication ,- 
2009,Mémoire n°36,Appel à témoins,51,- ,- ,- ,- 
2009,Mémoire n°37,Le patrimoine vizillois,3,Robert Aillaud ,"Pays vizillois , Vizille ",Bâtiments et édifices ,- 
2009,Mémoire n°37,Brié et ses environs en 1922 : promenade d'automne autour des 4 Seigneurs,04 à 11,J. Vaujany ,Herbeys ,Vie locale ,- 
2009,Mémoire n°37,Canal de navigation ou chemin de fer entre Grenoble et Vizille - Rêves et réalité,12 à 17,Alain Romestant ,Vizille ,"Voies de communication ,  Eau, rivières, canaux et fontaines ",- 
2009,Mémoire n°37,Vizille et ses commerces : La rue Aristide Briand (rue d'Italie),18 à 23,Jeannette Della-Vedova ,Vizille ,Vie locale ,- 
2009,Mémoire n°37,II - Le parc du vieux château du roi,24 à 27,Denis Bellon ,Vizille ,Bâtiments et édifices ,- 
2009,Mémoire n°37,Souvenirs d'enfance de Gavet au Poursollet,28,Annie Achard ,Livet et Gavet ,Vie locale ,- 
2009,Mémoire n°37,Centenaire des sapeurs-pompiers de Brié et Angonnes : 1909-2009,29 à 33,Paul Wohlschlegel ,Brié ,Evènements ,- 
2009,Mémoire n°37,L'auto-école il y a 40 ans,34,Robert Guillaud ,Vizille ,Vie locale ,- 
2009,Mémoire n°37,La prise du château de Champ par Lesdiguières le 1er avril 1587,35 à 37,Robert Aillaud ,Champ sur Drac ,Evènements ,- 
2009,Mémoire n°37,Une très jeune dame de 100 ans,38,Renée Gachet Berthon ,Vizille ,Personnages remarquables ,- 
2009,Mémoire n°37,Le petit musée de la coiffure,39 à 42,Jeannette Della-Vedova ,Vizille ,Vie locale ,XXIe siècle 
2009,Mémoire n°37,Curiosités de nos archives communales - Les curés racontent l'histoire,43 à 45,Pierre Coing Boyat ,Haute-Jarrie ,"Bâtiments et édifices ,  Religions ",- 
2009,Mémoire n°37,La masse d'arme du Chevalier Bayard,46 à 51,Robert Aillaud ,- ,"Personnages remarquables ,  Evènements ",- 
2010,Mémoire n°38,Adrienne,1,Robert Aillaud ,Jarrie ,Personnages remarquables ,- 
2010,Mémoire n°38,La pierre plate à Rioupéroux,2,Annie Achard ,Rioupéroux ,Lieux remarquables ,- 
2010,Mémoire n°38,Vizille et ses comerces : la boucherie Cret - 1908 à 1979 -1ère partie de la rue Jean Jaurès,03 à 06,Jeannette Della-Vedova ,Vizille ,Vie locale ,XXe siècle 
2010,Mémoire n°38,Vizille et ses commerces : La rue Aristide Briand (rue d'Italie) - 2ème partie,07 à 13,Jeannette Della-Vedova ,Vizille ,Vie locale ,XXIe siècle 
2010,Mémoire n°38,Brié et ses environs en 1922 : promenade d'automne autour des 4 Seigneurs,14 à 20,J. Vaujany ,Villeneuve d'Uriage ,Vie locale ,- 
2010,Mémoire n°38,Ou l'on retrouve les Hache ?,21 à 24,Pierre Melquiond ,Brié ,Personnages remarquables ,- 
2010,Mémoire n°38,Une ténébreuse affaire : la conspiration Didier,25 à 31,Alain Romestant ,Pays vizillois ,Evènements ,- 
2010,Mémoire n°38,L'histoire dans les archives - Le fonds Jouvin - Carnet du Sieur Corréard,32 à 33,Pierre Coing Boyat ,Jarrie ,Documents remarquables ,- 
2010,Mémoire n°38,A propos de... Les livres de raison,34,Denis Bellon ,France ,Documents remarquables ,- 
2010,Mémoire n°38,L'alambic de la Gaffe,35 à 37,Renée Rodolphe Vigroux ,Vizille ,Vie locale ,- 
2010,Mémoire n°38,Le chateau de paille dans les années 50,38 à 42,Michèle Ferrafiat Delahaye ,Vizille ,Vie locale ,- 
2010,Mémoire n°38,Histoires d'eaux au château de Paille,43 à 46,Denis Bellon ,Vizille ,"Eau, rivières, canaux et fontaines ",- 
2010,Mémoire n°38,Ozias Féronce : un grand astronome vizillois méconnu,47 à 50,Robert Aillaud ,Vizille ,Personnages remarquables ,- 
2010,Mémoire n°38,Attention... aux excès de vitesse !,52,Bernard Mingone ,Séchilienne ,Documents remarquables ,- 
2010,Mémoire n°39,Hommage à Pierre Melquiond,3,Robert Aillaud ,Brié et Angonnes ,Personnages remarquables ,- 
2010,Mémoire n°39,Histoire de la Poste (1e partie) à Vizille,04 à 05,Paul Fournier ,Vizille ,"Vie locale ,  Voies de communication ",- 
2010,Mémoire n°39,Sur la route de Montchaffrey,06 à 09,Jeannette Della-Vedova ,Montchaffrey ,Voies de communication ,XXe siècle 
2010,Mémoire n°39,Le secret d'Hercule - Conte de Noël,10 à 13,Jeannette Della-Vedova ,Vizille ,Contes et légendes ,XXIe siècle 
2010,Mémoire n°39,Un ouvrage sur le château de Bon Repos,13,- ,Jarrie ,Bâtiments et édifices ,- 
2010,Mémoire n°39,L'histoire dans les archives (suite),14 à 29,Pierre Coing Boyat ,Jarrie ,Documents remarquables ,- 
2010,Mémoire n°39,L'authenticité éxigée par l'histoire,30 à 35,Pierre Melquiond ,Brié et Angonnes ,Documents remarquables ,- 
2010,Mémoire n°39,Emile Rivet,36 à 37,Germaine Billon ,Saint Pierre de Mésage ,Personnages remarquables ,- 
2010,Mémoire n°39,Les cavalcades à Vizille (1e partie),38 à 41,Danielle Amar ,Vizille ,Evènements ,- 
2010,Mémoire n°39,"1310 - 2010, déjà 700 ans! Les libertés communales de Vizille",42 à 45,Denis Bellon ,Vizille ,Documents remarquables ,- 
2010,Mémoire n°39,Les chroniques oubliées : le contrat de mariage,46 à 50,Claude Ferradou ,Saint Pierre de Mésage ,Documents remarquables ,- 
2010,Mémoire n°39,Appel à recettes,51,Denis Bellon ,Pays vizillois ,Cuisine et recettes ,- 
2010,Mémoire n°39,La fabrication du pain à la ferme,51,Germaine Billon ,- ,Cuisine et recettes ,- 
2011,Mémoire n°41,Témoignage de Micheline Hauss,3,Micheline Hauss ,Vizille ,Personnages remarquables ,- 
2011,Mémoire n°41,Tous à vos souvenirs ! Qui peut compléter cette grille ?,4,- ,Pays vizillois ,Souvenirs ,- 
2011,Mémoire n°41,Les hommes de la conspiration Didier,05 à 11,Alain Romestant ,Pays vizillois ,Personnages remarquables ,- 
2011,Mémoire n°41,Histoire de la Poste (2e partie),12 à 17,Paul Fournier ,Vizille ,Vie locale ,- 
2011,Mémoire n°41,Les cavalcades à Vizille (2e partie),18 à 20,Danielle Amar ,Vizille ,Evènements ,- 
2011,Mémoire n°41,Les chroniques oubliées : le contrat de mariage,21 à 24,Claude Ferradou ,Saint Pierre de Mésage ,Documents remarquables ,- 
2011,Mémoire n°41,Historique de la maison Chamoux,25,? Chamoux ,Vizille ,Vie locale ,- 
2011,Mémoire n°41,Vizille et ses commerces : la rue Jean Jaurès (suite),26 à 29,Jeannette Della-Vedova ,Vizille ,Vie locale ,XXIe siècle 
2011,Mémoire n°41,Etre royaliste,30,- ,France ,Documents remarquables ,- 
2011,Mémoire n°41,La tradition de Guignol à Uriage,31 à 34,Charles Paillet ,Uriage ,Evènements ,- 
2011,Mémoire n°41,Notre-Dame-de-Jarrie,35 à 46,Pierre Coing Boyat ,Jarrie ,Vie locale ,- 
2011,Mémoire n°41,Berthe Vial,47,Yves Vial ,Vizille ,Personnages remarquables ,- 
2011,Mémoire n°41,"Le fils d'Ozias Féronce, l'astronome vizillois",48 à 50,Robert Aillaud ,Vizille ,Personnages remarquables ,- 
2012,Mémoire n°42,Le cimetière de Vizille,2,Daniel Blanc-Gonnet ,Vizille ,Bâtiments et édifices ,- 
2012,Mémoire n°42,Le monument aux morts de Vizille,03 à 07,Denis Bellon ,Vizille ,Bâtiments et édifices ,- 
2012,Mémoire n°42,"Les Jeux Olympiques modernes, une invention Grenobloise",08 à 16,"Gérard Mingat ,  Alain Romestant ",Grenoble ,Evènements ,- 
2012,Mémoire n°42,Repas de fête,17 à 18,Paul Wohlschlegel ,Vizille ,Vie locale ,- 
2012,Mémoire n°42,Notre-Dame-de-Jarrie (2e partie),19 à 27,Pierre Coing Boyat ,Jarrie ,Vie locale ,- 
2012,Mémoire n°42,Le Lac Mort de Laffrey à Saint-Barthélémy-de-Séchilienne,28 à 33,Alain Romestant ,Séchilienne ,"Vie locale ,  Activités industrielles ",- 
2012,Mémoire n°42,Mon premier travail...,34 à 35,Marie Del Net ,Vizille ,Vie locale ,- 
2012,Mémoire n°42,Curiosité,35,Paul Fournier ,Vizille ,Documents remarquables ,- 
2012,Mémoire n°42,Histoire de la Poste à Vizille (3e partie),36 à 40,Paul Fournier ,Vizille ,Vie locale ,- 
2012,Mémoire n°42,Cavalcades organisées par le Comité du sou des écoles (3e partie),41 à 45,Danielle Amar ,Vizille ,Evènements ,- 
2012,Mémoire n°42,Mon enfance à Livet - Jeanne Fagno née Bergonzoli,46 à 49,Jeannette Della-Vedova ,Livet et Gavet ,Personnages remarquables ,XXe siècle 
2012,Mémoire n°42,La chapelle Notre-Dame-sous-la-Croix à Chamrousse,50 à 54,Charles Paillet ,Chamrousse ,"Bâtiments et édifices ,  Religions ",- 
2012,Mémoire n°42,Souvenirs d'enfance aux Peyrauds,55 à 56,Germaine Billon ,Saint Pierre de Mésage ,Vie locale ,- 
2012,Mémoire n°42,Parcours d'un Français libre,57 à 58,Gwénaëlle Leyssieux ,Vizille ,Personnages remarquables ,- 
2012,Mémoire n°42,La vie de l'association,59 à 60,Denis Bellon ,Vizille ,Actualités ,- 
2012,Mémoire n°43,Avis de recherche,1,- ,Vizille ,Evènements ,- 
2012,Mémoire n°43,Les orgues historiques de Vizille,03 à 09,Denis Bellon ,Vizille ,"Bâtiments et édifices , Musique ",- 
2012,Mémoire n°43,La chapelle des Angonnes en 1867,10 à 13,Patrice Dore ,Vizille ,"Bâtiments et édifices , Religions ",- 
2012,Mémoire n°43,Histoire de la Reine de Mai ou le conte de l'Aspérule,14 à 18,Claude Ferradou ,Pays vizillois ,Contes et légendes ,- 
2012,Mémoire n°43,Les fêtes de Jarrie en 1867,19 à 23,Pierre Coing Boyat ,Jarrie ,Vie locale ,- 
2012,Mémoire n°43,Les tenues des facteurs,24,Paul Kiener ,France ,Personnages remarquables ,- 
2012,Mémoire n°43,"L'incroyable vie de Charles d'Albigny, seigneur de Séchilienne",25 à 31,Robert Aillaud ,Séchilienne ,Personnages remarquables ,- 
2012,Mémoire n°43,L'oeuvre de Charles Albert Keller dans l'électrométallurgie et la production d'énergie électrique,32 à 38,Alain Romestant ,Livet et Gavet ,Personnages remarquables ,- 
2012,Mémoire n°43,Le chemin des Huguenots,39 à 41,Renée Rodolphe Vigroux ,France ,Religions ,- 
2012,Mémoire n°43,Nomination d'un garde champêtre à Vizille,42 à 43,Paul Fournier ,Vizille ,Evènements ,- 
2012,Mémoire n°43,Les champignons,44 à 45,Jeannette Della-Vedova ,Vizille ,Vie locale ,XXe siècle 
2012,Mémoire n°43,La société mycologique de Vizille,46 à 53,"Jeannette Della-Vedova ,  Jacques Boffo ",Vizille ,Vie locale ,XXe siècle 
2012,Mémoire n°43,La tombe de la famille Du Terrail-Couvat dans l'ancien cimetière de Vizille,54 à 59,Daniel Blanc-Gonnet ,Vizille ,Personnages remarquables ,- 
2012,Mémoire n°43,Les productions des Amis de l'Histoire du Pays Vizillois,60,- ,Pays vizillois ,Actualités ,- 
2012,Mémoire n°43,Nos publications hors-séries,61,- ,Pays vizillois ,Actualités ,- 
2012,Mémoire n°43,La vie de l'association,62 à 64,- ,Pays vizillois ,Actualités ,- 
2013,Mémoire n°44,Michelle Perrot à travers la presse...,2,- ,France ,Personnages remarquables ,- 
2013,Mémoire n°44,Michelle Perrot : sur les traces de Lucie Baud,03 à 05,Michèle Perrot ,Vizille ,Personnages remarquables ,- 
2013,Mémoire n°44,Témoignage de Lucie Baud,06 à 14,Lucie Baud ,Vizille ,Personnages remarquables ,- 
2013,Mémoire n°44,L'histoire de l'Alliance Textile,15 à 24,Denis Bellon ,Vizille ,Activités industrielles ,- 
2013,Mémoire n°44,Un carré de soie représentant le château de Vizille,25,Raymond Platel ,Vizille ,Divers ,- 
2013,Mémoire n°44,Une autre vision peu flatteuse de Vizille en 1882,26,Paul Fournier ,Vizille ,Documents remarquables ,- 
2013,Mémoire n°44,Une résistante vizilloise à l'honneur,27,Renée Gachet Berthon ,Vizille ,Personnages remarquables ,- 
2013,Mémoire n°44,Adolphe Grimaldi,28 à 38,Gérard Mingat ,Vizille ,Personnages remarquables ,- 
2013,Mémoire n°44,Parcs et jardins de Brié et Angonnes,39 à 41,Patrice Dore ,Brié et Angonnes ,,- 
2013,Mémoire n°44,"Champ-sur-Drac et son musée d'histoire locale ""Autrefois""",42 à 46,Gilbert Gacon ,Champ sur Drac ,Vie locale ,- 
2013,Mémoire n°44,Le moulin de Tavernolles,47 à 49,Paul Wohlschlegel ,Tavernolles ,Bâtiments et édifices ,- 
2013,Mémoire n°44,La maison Allard au Louvaroux,50 à 55,Pierre Coing Boyat ,Jarrie ,,- 
2013,Mémoire n°44,Napoléon 1er à Tavernolles,56 à 59,Louis Sarte ,Tavernolles ,Personnages remarquables ,- 
2013,Mémoire n°44,Reculement de la Grande Rue à Vizille en 1893,60 à 61,"Renée Gachet Berthon ,  Gérard Berthon ",Vizille ,Vie locale ,- 
2013,Mémoire n°44,Les gypsoducs de Champ au XVIIIe siècle,62 à 66,Robert Aillaud ,Champ sur Drac ,Activités industrielles ,- 
2013,Mémoire n°44,Le symbolisme dans le cimetière de Vizille,67 à 69,Daniel Blanc-Gonnet ,Vizille ,,- 
2013,Mémoire n°44,La vie de l'association,70 à 72,- ,Vizille ,Actualités ,- 
2013,Mémoire n°45,Vous avez dit patrimoine ?,2,Denis Bellon ,Pays vizillois ,,- 
2013,Mémoire n°45,Bain de jouvence pour le château de Vizille,03 à 05,Paul Wohlschlegel ,Vizille ,,- 
2013,Mémoire n°45,"Lesdiguières, le renard des montagnes",06 à 09,Denis Bellon ,Vizille ,Personnages remarquables ,- 
2013,Mémoire n°45,"Claudine de Bérenger et François de Bonne, duc de Lesdiguières",10 à 17,Andrée Barras-Tixier ,Sassenage ,Personnages remarquables ,- 
2013,Mémoire n°45,L'évêque de Grenoble se suicide dans son château d'Herbeys,18 à 20,Gilbert Gacon ,Herbeys ,Evènements ,- 
2013,Mémoire n°45,Vous avez dit : lieux-dits ? Une histoire de toponymes,21 à 23,Paul Bernard ,Haute-Jarrie ,Toponymie ,- 
2013,Mémoire n°45,Le balancier et le bon Saint-Eloi,24,Patrice Dore ,Brié et Angonnes ,Personnages remarquables ,- 
2013,Mémoire n°45,Les archives anciennes de Brié et Angonnes,25 à 26,Patrice Dore ,Brié et Angonnes ,Documents remarquables ,- 
2013,Mémoire n°45,Souvenir... souvenir... Les Jeux Olympiques de Grenoble en 1968,27 à 29,Henri Girardy ,Grenoble ,Evènements ,- 
2013,Mémoire n°45,Une tentative d'incendie à Vizille,30 à 34,Pascale Beyls ,Vizille ,Evènements ,- 
2013,Mémoire n°45,"L'association des ""Amis de l'orgue de Vizille"" est née",35,Denis Bellon ,Vizille ,Vie locale ,- 
2013,Mémoire n°45,Le refuge de la société des Touristes du Dauphiné à La Morte,36 à 39,Daniel Etienne ,La Morte ,Vie locale ,- 
2013,Mémoire n°45,Vizille et ses commerces : la rue Jean Jaurès (3ème et dernière partie),40 à 50,Jeannette Della-Vedova ,Vizille ,Vie locale ,XXIe siècle 
2013,Mémoire n°45,"Vizille, ville d'eau",51 à 52,Gérard Berthon ,Vizille ,Vie locale ,- 
2013,Mémoire n°45,La généalogie de Lucie Baud,53 à 54,Daniel Etienne ,"Notre Dame de Mésage ,  Saint Pierre de Mésage ",Généalogie ,- 
2013,Mémoire n°45,La maison d'Hugues-Allerme au Louvaroux,55 à 58,Pierre Coing Boyat ,Jarrie ,,- 
2013,Mémoire n°45,Le cimetière de Vizille,59,Pierre Raymond Bonnardon ,Vizille ,,- 
2013,Mémoire n°45,Le symbolisme dans le cimetière de Vizille (suite),60 à 67,Daniel Blanc-Gonnet ,Vizille ,,- 
2013,Mémoire n°45,La vie de l'association,68 à 70,Collectif - les Amis de l'Histoire ,Pays vizillois ,Actualités ,- 
2013,Mémoire n°45,Table des articles publiés dans Mémoire 41 à 44,71 à 72,Collectif - les Amis de l'Histoire ,- ,Divers ,- 
2014,Mémoire n°46,Editorial,2,Denis Bellon ,Pays vizillois ,Actualités ,- 
2014,Mémoire n°46,Ambroise Croizat ou l'invention sociale,03 à 04,Michel Etievent ,France ,Personnages remarquables ,- 
2014,Mémoire n°46,Jean Métral raconte,05 à 07,Jean Metral ,Vizille ,Vie locale ,- 
2014,Mémoire n°46,Les jours heureux - Le programme du Conseil National de la Résistance,08 à 14,CNR ,France ,Actualités ,- 
2014,Mémoire n°46,Les Etats Généraux de la Résistance à Vizille,15 à 19,Denis Bellon ,Vizille ,Evènements ,- 
2014,Mémoire n°46,Les Justes - Justes parmi les Nations,20,Denis Bellon ,France ,Evènements ,- 
2014,Mémoire n°46,Circonstances du sauvetage et recherches,21 à 25,Jacqueline Szister-Bismuth ,Vizille ,Evènements ,- 
2014,Mémoire n°46,La République des enfants de Moulin Vieux (1),26 à 27,Denis Bellon ,La Morte ,Enseignement ,- 
2014,Mémoire n°46,Le stade René Perrouault à Champ-sur-Drac,28 à 30,Jacques Nivon ,Champ sur Drac ,Vie locale ,- 
2014,Mémoire n°46,Le sous-lieutenant Joseph Auguste Floxoli,31,Alain Floxoli ,Vizille ,Personnages remarquables ,- 
2014,Mémoire n°46,Quelques heures avant la Libération,32 à 37,Cécile Riviere ,Vizille ,Evènements ,- 
2014,Mémoire n°46,Une triste fin,38 à 40,Paul Wohlschlegel ,Rioupéroux ,Evènements ,- 
2014,Mémoire n°46,Ils venaient d'avoir 18 ans... Les conscrits,41 à 49,Jeannette Della-Vedova ,Vizille ,Personnages remarquables ,XXe siècle 
2014,Mémoire n°46,Aout 1944 - Une période tragique à La Morte et dans le Taillefer,50 à 59,Daniel Etienne ,La Morte ,Vie locale ,- 
2014,Mémoire n°46,Les chantiers de la jeunesse,60 à 61,Denis Bellon ,France ,Vie locale ,- 
2014,Mémoire n°46,Chantiers de jeunesse n°12,62 à 69,Raymond Devey ,Belledonne ,Vie locale ,- 
2014,Mémoire n°46,La vie de l'association - Deuxième semestre 2013,70 à 72,Collectif - les Amis de l'Histoire ,- ,Actualités ,- 
2014,Mémoire n°47,"Albert Lebrun, le dernier Président de la IIIe République",03 à 08,Eric Freysselinard ,Vizille ,Personnages remarquables ,- 
2014,Mémoire n°47,A travers la presse régionale et nationale,09 à 24,Collectif - les Amis de l'Histoire ,Vizille ,Personnages remarquables ,- 
2014,Mémoire n°47,L'orgue de Vizille,24,Denis Bellon ,Vizille ,Vie locale ,- 
2014,Mémoire n°47,"Aimé Guille, portrait d'un résistant",25 à 26,"Gilbert Gacon ,  Denis Bellon ",Vizille ,Personnages remarquables ,- 
2014,Mémoire n°47,Les états généraux de la Résistance,27 à 28,- ,France ,Evènements ,- 
2014,Mémoire n°47,Yvonne Bonthoux et Jean-Marcel Champon,29 à 30,Dominique Rossi ,Vizille ,Personnages remarquables ,- 
2014,Mémoire n°47,Ma rencontre avec Pierre Draï,31,Jeannette Della-Vedova ,Vizille ,Personnages remarquables ,XXe siècle 
2014,Mémoire n°47,La mémoire dévérouillée,32 à 33,Pierre Draï ,France ,Documents remarquables ,- 
2014,Mémoire n°47,Moulin-Vieux ou les enfants de la République,34 à 40,Pierre Draï ,La Morte ,Enseignement ,- 
2014,Mémoire n°47,Le château de Vizille efface les traces de ses blessures,41 à 42,- ,Vizille ,Vie locale ,- 
2014,Mémoire n°47,Les timbres de la Libération,43,Paul Kiener ,France ,Divers ,- 
2014,Mémoire n°47,Groupes-francs contre les Forces de l'Ordre dans l'Isère,44 à 48,- ,Vizille ,Vie locale ,- 
2014,Mémoire n°47,"André Morel, mon voisin de palier",49 à 51,Alain Romestant ,Grenoble ,Personnages remarquables ,- 
2014,Mémoire n°47,Morts pour la France dans le Pays Vizillois,52 à 55,Renée Vigroux ,Pays vizillois ,Vie locale ,- 
2014,Mémoire n°47,La grande guerre de 1914-1918 - Vizille et ses soldats décédés en 1914,56 à 63,Daniel Blanc-Gonnet ,Vizille ,"Vie locale ,  Guerres ",- 
2014,Mémoire n°47,La guerre 14/18 et l'utilisation des gaz de combat,64 à 66,Gilbert Gacon ,"Claix ,  Jarrie ",Evènements ,- 
2014,Mémoire n°47,Les belles années des corsos à Vizille - 1971/1997,67 à 81,Jeannette Della-Vedova ,Vizille ,Vie locale ,XXIe siècle 
2014,Mémoire n°47,La chasse aux bornes est ouverte...,82 à 84,Robert Aillaud ,Isère ,Divers ,- 
2015,Mémoire n°48,Le séjour de Napoléon à l'île d'Elbe,03 à 06,Denis Bellon ,France ,Personnages remarquables ,- 
2015,Mémoire n°48,La route Napoléon,07 à 13,"Gilbert Gacon ,  Denis Bellon ",France ,Voies de communication ,- 
2015,Mémoire n°48,La statue de Napoléon 1er à Laffrey,14 à 20,Jeannette Della-Vedova ,Laffrey ,Personnages remarquables ,XXe siècle 
2015,Mémoire n°48,"Les mémoires de Basile Bonnardon, médecin à Vizille 1786-1863",21,Basile Bonnardon ,Pays vizillois ,Personnages remarquables ,- 
2015,Mémoire n°48,Le cadastre napoléonien,22,Denis Bellon ,France ,Documents remarquables ,- 
2015,Mémoire n°48,Alexandre Debelle,23,Denis Bellon ,Grenoble ,Personnages remarquables ,- 
2015,Mémoire n°48,Le passage de Napoléon lors de son retour de l'île d'Elbe,24,Daniel Blanc-Gonnet ,France ,Personnages remarquables ,- 
2015,Mémoire n°48,"Alexandre Zeis, instituteur et géomètre",27 à 29,Gérard Mingat ,Vaulnaveys ,Personnages remarquables ,- 
2015,Mémoire n°48,Le colonel Moustache de St-Barthélémy de Séchilienne,30 à 38,Gilles Strappazzon ,Saint Barthélémy de Séchilienne ,Personnages remarquables ,- 
2015,Mémoire n°48,Vizille a toujours été fidèle à l'Empereur et à sa descendance,39,Paul Fournier ,Vizille ,Vie locale ,- 
2015,Mémoire n°48,La grande guerre de 1914-1918 - Vizille et ses soldats décédés entre le 1er janvier et le 30 juin 1915,40 à 43,"Daniel Blanc-Gonnet ,  Marie-Claude Argoud ",Vizille ,"Vie locale ,  Guerres ",- 
2015,Mémoire n°48,Uriage-les-Bains - Hôpital militaire complémentaire n°42 (1914-1919),44 à 54,Charles Paillet ,Uriage ,Vie locale ,- 
2015,Mémoire n°48,Le mystère de Saint Firmin ou la légende de la cloche à la sauge,55 à 70,Claude Ferradou ,Notre Dame de Mésage ,Contes et légendes ,- 
2015,Mémoire n°48,Les belles années des corsos à Vizille - les années 80 (suite),71 à 83,Jeannette Della-Vedova ,Vizille ,Vie locale ,XXe siècle 
2015,Mémoire n°49,Mourir une deuxième fois,2,Denis Bellon ,- ,Edito ,- 
2015,Mémoire n°49,"Histoire d'un résistant un peu spécial : Jean Freysselinard , le gendre du président Albert Lebrun à Vizille",03 à 05,Eric Freysselinard ,Villeneuve d'Uriage ,"Vie locale ,  Guerres ,  Personnages remarquables ",XXe siècle 
2015,Mémoire n°49,la SAMA Société Anonyme des Meles artificielles,06 à 09,Denis Bellon ,Vizille ,Activités industrielles ,XXe siècle 
2015,Mémoire n°49,Souvenirs au fil des saisons,10 à 11,Marie Del Net ,Vizille ,"Vie locale ,  Souvenirs ",XXIe siècle 
2015,Mémoire n°49,La Grande Guerre de 1914-1918 : Vizille et ses soldats décédés entre le 1er juillet et le 31 décembre 1915,12 à 18,"Daniel Blanc-Gonnet ,  Marie-Claude Argoud ",Vizille ,Guerres ,XXe siècle 
2015,Mémoire n°49,Les quatrièmes grand rendez-vous de l'histoire du Pays Vizillois : mai/juin 2016,19,Denis Bellon ,Vizille ,Vie de l'association ,XXIe siècle 
2015,Mémoire n°49,L'hôpital temporaire de La Valentine,20 à 23,Pierre Coing Boyat ,Jarrie ,"Guerres ,  Médecine ",XXe siècle 
2015,Mémoire n°49,Vizille et sa piscine,24 à 29,Danielle Amar ,Vizille ,"Vie locale ,  Bâtiments et édifices , Sport ",XXIe siècle 
2015,Mémoire n°49,Le centre d'apprentissage de Vizille,30 à 33,Pierre Draï ,Vizille ,"Enseignement ,  Souvenirs ",XXe siècle 
